{"budget_index": 1, "campaign_id": "resnet_trigger_append_only_summary_ablation", "cumulative_budget_consumed": 1, "current_best_before": null, "decision": "kept", "decision_rationale": "First valid metric becomes the current best.", "delta_vs_best": null, "execution_status": "success", "extra": {}, "failure_category": null, "git_commit_after": "dry-after-001", "git_commit_before": "dry-before-001", "manager_mode": "baseline_manager", "memory_mode": "append_only_summary", "node_id": "resnet_trigger", "parsed_metrics": {"val_auc": 0.781}, "patch_ref": "experiments/artifacts/dry_run_trial_001/patch.diff", "proposal_rationale": "A conservative learning-rate reduction is a strong first baseline for stabilizing validation AUC.", "proposal_summary": "lower-learning-rate", "provenance": {"decision_id": "decision-217caee0b966d964", "metric_id": "metric-217caee0b966d964", "patch_id": "patch-217caee0b966d964", "proposal_id": "proposal-217caee0b966d964", "run_id": "run-217caee0b966d964"}, "raw_log_ref": "experiments/artifacts/dry_run_trial_001/run.log", "targeted_files": ["train.py"], "timestamp_end": "2026-04-29T14:50:20Z", "timestamp_start": "2026-04-29T14:50:20Z", "trial_id": "resnet_trigger_append_only_summary_ablation-trial-001", "validity_status": "valid", "wall_clock_seconds": 1.0, "worker_mode": "dry_run_worker"}
{"budget_index": 2, "campaign_id": "resnet_trigger_append_only_summary_ablation", "cumulative_budget_consumed": 2, "current_best_before": 0.781, "decision": "kept", "decision_rationale": "Candidate improved maximize objective by 0.001000.", "delta_vs_best": 0.0010000000000000009, "execution_status": "success", "extra": {}, "failure_category": null, "git_commit_after": "dry-after-002", "git_commit_before": "dry-before-002", "manager_mode": "baseline_manager", "memory_mode": "append_only_summary", "node_id": "resnet_trigger", "parsed_metrics": {"val_auc": 0.782}, "patch_ref": "experiments/artifacts/dry_run_trial_002/patch.diff", "proposal_rationale": "A small amount of regularization may improve near-threshold generalization.", "proposal_summary": "small-dropout", "provenance": {"decision_id": "decision-09c0dd6e115abfe9", "metric_id": "metric-09c0dd6e115abfe9", "patch_id": "patch-09c0dd6e115abfe9", "proposal_id": "proposal-09c0dd6e115abfe9", "run_id": "run-09c0dd6e115abfe9"}, "raw_log_ref": "experiments/artifacts/dry_run_trial_002/run.log", "targeted_files": ["train.py"], "timestamp_end": "2026-04-29T14:50:20Z", "timestamp_start": "2026-04-29T14:50:20Z", "trial_id": "resnet_trigger_append_only_summary_ablation-trial-002", "validity_status": "valid", "wall_clock_seconds": 1.0, "worker_mode": "dry_run_worker"}
{"budget_index": 3, "campaign_id": "resnet_trigger_append_only_summary_ablation", "cumulative_budget_consumed": 3, "current_best_before": 0.782, "decision": "kept", "decision_rationale": "Candidate improved maximize objective by 0.001000.", "delta_vs_best": 0.0010000000000000009, "execution_status": "success", "extra": {}, "failure_category": null, "git_commit_after": "dry-after-003", "git_commit_before": "dry-before-003", "manager_mode": "baseline_manager", "memory_mode": "append_only_summary", "node_id": "resnet_trigger", "parsed_metrics": {"val_auc": 0.783}, "patch_ref": "experiments/artifacts/dry_run_trial_003/patch.diff", "proposal_rationale": "A lighter weight decay can improve fit if the current model is underfitting.", "proposal_summary": "lower-weight-decay", "provenance": {"decision_id": "decision-c8a81682e3b0cf01", "metric_id": "metric-c8a81682e3b0cf01", "patch_id": "patch-c8a81682e3b0cf01", "proposal_id": "proposal-c8a81682e3b0cf01", "run_id": "run-c8a81682e3b0cf01"}, "raw_log_ref": "experiments/artifacts/dry_run_trial_003/run.log", "targeted_files": ["train.py"], "timestamp_end": "2026-04-29T14:50:20Z", "timestamp_start": "2026-04-29T14:50:20Z", "trial_id": "resnet_trigger_append_only_summary_ablation-trial-003", "validity_status": "valid", "wall_clock_seconds": 1.0, "worker_mode": "dry_run_worker"}
{"budget_index": 1, "campaign_id": "resnet_trigger_append_only_summary_ablation", "cumulative_budget_consumed": 1, "current_best_before": 0.783, "decision": "discarded", "decision_rationale": "Candidate did not improve current best; delta=-0.002000.", "delta_vs_best": -0.0020000000000000018, "execution_status": "success", "extra": {}, "failure_category": "degraded_metric", "git_commit_after": "dry-after-001", "git_commit_before": "dry-before-001", "manager_mode": "baseline_manager", "memory_mode": "append_only_summary", "node_id": "resnet_trigger", "parsed_metrics": {"val_auc": 0.781}, "patch_ref": "experiments/artifacts/dry_run_trial_001/patch.diff", "proposal_rationale": "A conservative learning-rate reduction is a strong first baseline for stabilizing validation AUC.", "proposal_summary": "lower-learning-rate", "provenance": {"decision_id": "decision-217caee0b966d964", "metric_id": "metric-217caee0b966d964", "patch_id": "patch-217caee0b966d964", "proposal_id": "proposal-217caee0b966d964", "run_id": "run-217caee0b966d964"}, "raw_log_ref": "experiments/artifacts/dry_run_trial_001/run.log", "targeted_files": ["train.py"], "timestamp_end": "2026-04-29T14:50:32Z", "timestamp_start": "2026-04-29T14:50:32Z", "trial_id": "resnet_trigger_append_only_summary_ablation-trial-001", "validity_status": "valid", "wall_clock_seconds": 1.0, "worker_mode": "dry_run_worker"}
{"budget_index": 2, "campaign_id": "resnet_trigger_append_only_summary_ablation", "cumulative_budget_consumed": 2, "current_best_before": 0.783, "decision": "discarded", "decision_rationale": "Candidate did not improve current best; delta=-0.001000.", "delta_vs_best": -0.0010000000000000009, "execution_status": "success", "extra": {}, "failure_category": "degraded_metric", "git_commit_after": "dry-after-002", "git_commit_before": "dry-before-002", "manager_mode": "baseline_manager", "memory_mode": "append_only_summary", "node_id": "resnet_trigger", "parsed_metrics": {"val_auc": 0.782}, "patch_ref": "experiments/artifacts/dry_run_trial_002/patch.diff", "proposal_rationale": "A small amount of regularization may improve near-threshold generalization.", "proposal_summary": "small-dropout", "provenance": {"decision_id": "decision-09c0dd6e115abfe9", "metric_id": "metric-09c0dd6e115abfe9", "patch_id": "patch-09c0dd6e115abfe9", "proposal_id": "proposal-09c0dd6e115abfe9", "run_id": "run-09c0dd6e115abfe9"}, "raw_log_ref": "experiments/artifacts/dry_run_trial_002/run.log", "targeted_files": ["train.py"], "timestamp_end": "2026-04-29T14:50:32Z", "timestamp_start": "2026-04-29T14:50:32Z", "trial_id": "resnet_trigger_append_only_summary_ablation-trial-002", "validity_status": "valid", "wall_clock_seconds": 1.0, "worker_mode": "dry_run_worker"}
{"budget_index": 3, "campaign_id": "resnet_trigger_append_only_summary_ablation", "cumulative_budget_consumed": 3, "current_best_before": 0.783, "decision": "discarded", "decision_rationale": "Candidate did not improve current best; delta=0.000000.", "delta_vs_best": 0.0, "execution_status": "success", "extra": {}, "failure_category": "degraded_metric", "git_commit_after": "dry-after-003", "git_commit_before": "dry-before-003", "manager_mode": "baseline_manager", "memory_mode": "append_only_summary", "node_id": "resnet_trigger", "parsed_metrics": {"val_auc": 0.783}, "patch_ref": "experiments/artifacts/dry_run_trial_003/patch.diff", "proposal_rationale": "A lighter weight decay can improve fit if the current model is underfitting.", "proposal_summary": "lower-weight-decay", "provenance": {"decision_id": "decision-c8a81682e3b0cf01", "metric_id": "metric-c8a81682e3b0cf01", "patch_id": "patch-c8a81682e3b0cf01", "proposal_id": "proposal-c8a81682e3b0cf01", "run_id": "run-c8a81682e3b0cf01"}, "raw_log_ref": "experiments/artifacts/dry_run_trial_003/run.log", "targeted_files": ["train.py"], "timestamp_end": "2026-04-29T14:50:32Z", "timestamp_start": "2026-04-29T14:50:32Z", "trial_id": "resnet_trigger_append_only_summary_ablation-trial-003", "validity_status": "valid", "wall_clock_seconds": 1.0, "worker_mode": "dry_run_worker"}
{"budget_index": 1, "campaign_id": "resnet_trigger_append_only_summary_ablation", "cumulative_budget_consumed": 1, "current_best_before": 0.783, "decision": "discarded", "decision_rationale": "Candidate did not improve current best; delta=-0.002000.", "delta_vs_best": -0.0020000000000000018, "execution_status": "success", "extra": {}, "failure_category": "degraded_metric", "git_commit_after": "dry-after-001", "git_commit_before": "dry-before-001", "manager_mode": "baseline_manager", "memory_mode": "append_only_summary", "node_id": "resnet_trigger", "parsed_metrics": {"val_auc": 0.781}, "patch_ref": "experiments/artifacts/dry_run_trial_001/patch.diff", "proposal_rationale": "A conservative learning-rate reduction is a strong first baseline for stabilizing validation AUC.", "proposal_summary": "lower-learning-rate", "provenance": {"decision_id": "decision-217caee0b966d964", "metric_id": "metric-217caee0b966d964", "patch_id": "patch-217caee0b966d964", "proposal_id": "proposal-217caee0b966d964", "run_id": "run-217caee0b966d964"}, "raw_log_ref": "experiments/artifacts/dry_run_trial_001/run.log", "targeted_files": ["train.py"], "timestamp_end": "2026-04-29T14:50:38Z", "timestamp_start": "2026-04-29T14:50:38Z", "trial_id": "resnet_trigger_append_only_summary_ablation-trial-001", "validity_status": "valid", "wall_clock_seconds": 1.0, "worker_mode": "dry_run_worker"}
{"budget_index": 2, "campaign_id": "resnet_trigger_append_only_summary_ablation", "cumulative_budget_consumed": 2, "current_best_before": 0.783, "decision": "discarded", "decision_rationale": "Candidate did not improve current best; delta=-0.001000.", "delta_vs_best": -0.0010000000000000009, "execution_status": "success", "extra": {}, "failure_category": "degraded_metric", "git_commit_after": "dry-after-002", "git_commit_before": "dry-before-002", "manager_mode": "baseline_manager", "memory_mode": "append_only_summary", "node_id": "resnet_trigger", "parsed_metrics": {"val_auc": 0.782}, "patch_ref": "experiments/artifacts/dry_run_trial_002/patch.diff", "proposal_rationale": "A small amount of regularization may improve near-threshold generalization.", "proposal_summary": "small-dropout", "provenance": {"decision_id": "decision-09c0dd6e115abfe9", "metric_id": "metric-09c0dd6e115abfe9", "patch_id": "patch-09c0dd6e115abfe9", "proposal_id": "proposal-09c0dd6e115abfe9", "run_id": "run-09c0dd6e115abfe9"}, "raw_log_ref": "experiments/artifacts/dry_run_trial_002/run.log", "targeted_files": ["train.py"], "timestamp_end": "2026-04-29T14:50:38Z", "timestamp_start": "2026-04-29T14:50:38Z", "trial_id": "resnet_trigger_append_only_summary_ablation-trial-002", "validity_status": "valid", "wall_clock_seconds": 1.0, "worker_mode": "dry_run_worker"}
{"budget_index": 3, "campaign_id": "resnet_trigger_append_only_summary_ablation", "cumulative_budget_consumed": 3, "current_best_before": 0.783, "decision": "discarded", "decision_rationale": "Candidate did not improve current best; delta=0.000000.", "delta_vs_best": 0.0, "execution_status": "success", "extra": {}, "failure_category": "degraded_metric", "git_commit_after": "dry-after-003", "git_commit_before": "dry-before-003", "manager_mode": "baseline_manager", "memory_mode": "append_only_summary", "node_id": "resnet_trigger", "parsed_metrics": {"val_auc": 0.783}, "patch_ref": "experiments/artifacts/dry_run_trial_003/patch.diff", "proposal_rationale": "A lighter weight decay can improve fit if the current model is underfitting.", "proposal_summary": "lower-weight-decay", "provenance": {"decision_id": "decision-c8a81682e3b0cf01", "metric_id": "metric-c8a81682e3b0cf01", "patch_id": "patch-c8a81682e3b0cf01", "proposal_id": "proposal-c8a81682e3b0cf01", "run_id": "run-c8a81682e3b0cf01"}, "raw_log_ref": "experiments/artifacts/dry_run_trial_003/run.log", "targeted_files": ["train.py"], "timestamp_end": "2026-04-29T14:50:38Z", "timestamp_start": "2026-04-29T14:50:38Z", "trial_id": "resnet_trigger_append_only_summary_ablation-trial-003", "validity_status": "valid", "wall_clock_seconds": 1.0, "worker_mode": "dry_run_worker"}
